"","text","favorited","favoriteCount","replyToSN","created","truncated","replyToSID","id","replyToUID","statusSource","screenName","retweetCount","isRetweet","retweeted","longitude","latitude"
"1021","@ChampagneSoki Elon Musk doesn‚Äôt approve this.",FALSE,0,"ChampagneSoki",2018-04-05 10:55:20,FALSE,"981638912098516992","981847752702296064","129575487","<a href=""http://twitter.com/download/iphone"" rel=""nofollow"">Twitter for iPhone</a>","crisforanime",0,FALSE,FALSE,NA,NA
"1022","Elon Musk Cheers On Trump As U.S. Prepares Stiff Tariffs On Chinese Products
https://t.co/ZwAF87dJII",FALSE,0,NA,2018-04-05 10:54:21,FALSE,NA,"981847504462348288",NA,"<a href=""http://twitter.com"" rel=""nofollow"">Twitter Web Client</a>","outforbeer",0,FALSE,FALSE,NA,NA
"1023","@HeyLaurenSummer what do you think of Elon Musk and humans going to Mars?",FALSE,0,"HeyLaurenSummer",2018-04-05 10:52:18,FALSE,"981631755995287552","981846987204104192","796568665558839296","<a href=""http://twitter.com"" rel=""nofollow"">Twitter Web Client</a>","JJz_112",0,FALSE,FALSE,NA,NA
"1024","Are Elon Musk and Sean Penn ok? Dear God, please tell me they're not hurt... I don't know what to do! Please, mercy! Jesus fucking Christ...",FALSE,0,NA,2018-04-05 10:52:17,FALSE,NA,"981846984012083200",NA,"<a href=""http://twitter.com/download/android"" rel=""nofollow"">Twitter for Android</a>","RavenWildchild1",0,FALSE,FALSE,NA,NA
"1025","The importance of developing multiple core pursuits before entering retirement. https://t.co/MkED5CxIpk",FALSE,1,NA,2018-04-05 10:50:12,FALSE,NA,"981846458247864320",NA,"<a href=""http://twitter.com/download/iphone"" rel=""nofollow"">Twitter for iPhone</a>","jtg142",1,FALSE,FALSE,NA,NA
"1026","Have you done similar to Elon Musk and stopped using Facebook after the data breach? Has the recent news regarding‚Ä¶ https://t.co/7zKI1LuDM1",FALSE,2,NA,2018-04-05 10:50:03,TRUE,NA,"981846421543489537",NA,"<a href=""http://bufferapp.com"" rel=""nofollow"">Buffer</a>","BristowandHardy",1,FALSE,FALSE,NA,NA
"1027","New post (Elon Musk Wants to Blanket the World With the Best Satellite Internet Service Ever. The FCC Just Said Yes‚Ä¶ https://t.co/vDW5MXfyXQ",FALSE,0,NA,2018-04-05 10:49:55,TRUE,NA,"981846387301154816",NA,"<a href=""http://www.prosandconstv.com"" rel=""nofollow"">Pros and Cons TV</a>","csitnigeria",0,FALSE,FALSE,NA,NA
"1028","Elon Musk Wants to Blanket the World With the Best Satellite Internet Service Ever. The FCC Just Said¬†Yes https://t.co/1VnAN4KnKe",FALSE,0,NA,2018-04-05 10:48:58,FALSE,NA,"981846150583062529",NA,"<a href=""http://publicize.wp.com/"" rel=""nofollow"">WordPress.com</a>","csitnigeria",0,FALSE,FALSE,NA,NA
"1029","Elon Musk Cheers On Trump As U.S. Prepares Stiff Tariffs On Chinese Products https://t.co/rjgfZBTUNN https://t.co/0XVpnKYt16",FALSE,105,NA,2018-04-05 10:48:38,FALSE,NA,"981846065673588737",NA,"<a href=""http://www.socialflow.com"" rel=""nofollow"">SocialFlow</a>","DailyCaller",68,FALSE,FALSE,NA,NA
"1030","[WP] James Bond meets his match when facing a group of international assassins hidden in the public eye- Elon Musk,‚Ä¶ https://t.co/lrXxf0F2AW",FALSE,0,NA,2018-04-05 10:47:26,TRUE,NA,"981845763654406144",NA,"<a href=""https://ifttt.com"" rel=""nofollow"">IFTTT</a>","rWritingPrompts",0,FALSE,FALSE,NA,NA
"1031","I liked a @YouTube video https://t.co/Z9L1KhhN32 What Elon Musk's Payday Means for Tesla's Future",FALSE,0,NA,2018-04-05 10:46:43,FALSE,NA,"981845584633040897",NA,"<a href=""http://www.google.com/"" rel=""nofollow"">Google</a>","danyman12345",0,FALSE,FALSE,NA,NA
"1032","@AkilStokesRTM You need a Elon musk roof and power wall. When the grid starts failing...",FALSE,1,"AkilStokesRTM",2018-04-05 10:46:43,FALSE,"981687174025400320","981845581235740672","220851894","<a href=""http://twitter.com/download/iphone"" rel=""nofollow"">Twitter for iPhone</a>","hardyhardyhaha",0,FALSE,FALSE,NA,NA
"1033","I added a video to a @YouTube playlist https://t.co/yrS4ldhHtY Elon Musk Announces New Plan to Revolutionize Global Travel",FALSE,0,NA,2018-04-05 10:45:51,FALSE,NA,"981845365837193217",NA,"<a href=""http://www.google.com/"" rel=""nofollow"">Google</a>","quianamonet2",0,FALSE,FALSE,NA,NA
"1034","Elon Musk has no time for your false shit. : https://t.co/AdtqDMoSUo",FALSE,0,NA,2018-04-05 10:45:41,FALSE,NA,"981845323625783296",NA,"<a href=""https://ifttt.com"" rel=""nofollow"">IFTTT</a>","BestoReddit",0,FALSE,FALSE,NA,NA
"1035","Elon Musk has no time for your false shit. https://t.co/m0x1BHwCUu",FALSE,0,NA,2018-04-05 10:45:36,FALSE,NA,"981845302176108546",NA,"<a href=""https://ifttt.com"" rel=""nofollow"">IFTTT</a>","DamiensHeart",0,FALSE,FALSE,NA,NA
"1036","https://t.co/ZT1ULgcKDL
There's Always Two sides to Any Story ! You can Bet Fake Media wants no part of this Story !",FALSE,1,NA,2018-04-05 10:45:25,FALSE,NA,"981845254524485632",NA,"<a href=""http://twitter.com/download/android"" rel=""nofollow"">Twitter for Android</a>","DOCTORC15",1,FALSE,FALSE,NA,NA
"1037","Elon Musk has no time for your false shit. https://t.co/PoSUPPRcu3",FALSE,7,NA,2018-04-05 10:42:07,FALSE,NA,"981844427042951168",NA,"<a href=""https://ifttt.com"" rel=""nofollow"">IFTTT</a>","atticanibal",1,FALSE,FALSE,NA,NA
"1038","Elon Musk Jokes About Tesla‚Äôs Debt ‚Äì But the Joke Could Be on the U.S. https://t.co/hgxArsVrQ7",FALSE,0,NA,2018-04-05 10:41:47,FALSE,NA,"981844342775132161",NA,"<a href=""http://www.occuworld.org"" rel=""nofollow"">OccuWorld</a>","OccuWorld",0,FALSE,FALSE,NA,NA
"1039","#outsiders Dumb pollies, if we blow up all our coal-fired power plants, how are we going to maintain our baseload p‚Ä¶ https://t.co/b8ZDnsIueD",FALSE,2,NA,2018-04-05 10:40:57,TRUE,NA,"981844130597715968",NA,"<a href=""http://twitter.com"" rel=""nofollow"">Twitter Web Client</a>","phlim1942",3,FALSE,FALSE,NA,NA
"1040","Elon Musk has no time for your false shit. https://t.co/llCn1ZjUJv",FALSE,0,NA,2018-04-05 10:39:29,FALSE,NA,"981843760848846848",NA,"<a href=""https://dlvrit.com/"" rel=""nofollow"">dlvr.it</a>","mrgrumpysteven",0,FALSE,FALSE,NA,NA
"1041","Elon Musk has no time for your false shit. https://t.co/zvoMu95W7Z",FALSE,0,NA,2018-04-05 10:39:14,FALSE,NA,"981843701679915009",NA,"<a href=""http://www.google.com/"" rel=""nofollow"">Google</a>","dogefan",0,FALSE,FALSE,NA,NA
"1042","Elon Musk joins other experts in call for global ban on killer robots via the @FoxNews App https://t.co/EpfyWyf7RW",FALSE,0,NA,2018-04-05 10:37:58,FALSE,NA,"981843379427467264",NA,"<a href=""http://twitter.com/download/iphone"" rel=""nofollow"">Twitter for iPhone</a>","wolfeman50",0,FALSE,FALSE,NA,NA
"1043","Does Elon musk have the solution to lacking productivity? The limitless pill is said to be on‚Ä¶ https://t.co/2AtERrJDwZ",FALSE,0,NA,2018-04-05 10:37:37,FALSE,NA,"981843291208495104",NA,"<a href=""http://instagram.com"" rel=""nofollow"">Instagram</a>","BookSkanky",0,FALSE,FALSE,NA,NA
"1044","Elon Musk has no time for your false shit. https://t.co/LnZVyhxRGN",FALSE,0,NA,2018-04-05 10:36:24,FALSE,NA,"981842985280327681",NA,"<a href=""https://ifttt.com"" rel=""nofollow"">IFTTT</a>","TopRedditPost",0,FALSE,FALSE,NA,NA
"1045","Elon Musk has no time for your false shit. https://t.co/WuamTzWIPy",FALSE,0,NA,2018-04-05 10:36:20,FALSE,NA,"981842970965172224",NA,"<a href=""https://ifttt.com"" rel=""nofollow"">IFTTT</a>","zane_meme",0,FALSE,FALSE,NA,NA
"1046","I liked a @YouTube video https://t.co/EptQ5gXtsf Elon Musk On Production Issues and Solutions at Tesla Car Factory. (Webcast Recap).",FALSE,0,NA,2018-04-05 10:35:45,FALSE,NA,"981842822398726147",NA,"<a href=""http://www.google.com/"" rel=""nofollow"">Google</a>","dorsai_55",0,FALSE,FALSE,NA,NA
"1047","@Model3Owners The right way, imho, is to convince Elon Musk to enable and roll out the dash cam cloud app he talked‚Ä¶ https://t.co/uB3wjMkX42",FALSE,0,"Model3Owners",2018-04-05 10:34:16,TRUE,"981535048624095232","981842451991285760","704835627183788032","<a href=""http://twitter.com/download/iphone"" rel=""nofollow"">Twitter for iPhone</a>","KjellEIms",0,FALSE,FALSE,NA,NA
"1048","SpaceX and Tesla CEO Elon Musk shares how much bitcoin a friend sent him ""many years ago"" amid discussions of crypt‚Ä¶ https://t.co/aE6KEeATIS",FALSE,0,NA,2018-04-05 10:34:04,TRUE,NA,"981842401345130496",NA,"<a href=""http://bufferapp.com"" rel=""nofollow"">Buffer</a>","CryptoIronic",0,FALSE,FALSE,NA,NA
"1049","Elon Musk has no time for your false shit. (Share-it) https://t.co/N9zy3fGQ2X https://t.co/eTI2Ci9Lvq",FALSE,0,NA,2018-04-05 10:33:45,FALSE,NA,"981842321691037696",NA,"<a href=""https://ifttt.com"" rel=""nofollow"">IFTTT</a>","ForkKatie",0,FALSE,FALSE,NA,NA
"1050","Ocean Sciences Article of the Day - Opinion: Tesla‚Äôs Manufacturing ‚ÄòHell‚Äô Won‚Äôt Slow Down Electric Cars (New York T‚Ä¶ https://t.co/bP343hVEe1",FALSE,0,NA,2018-04-05 10:33:40,TRUE,NA,"981842297410281472",NA,"<a href=""http://twitter.com"" rel=""nofollow"">Twitter Web Client</a>","CAPTRick74",0,FALSE,FALSE,NA,NA
"1051","Elon Musk On Production Issues and Solutions at Tesla Car Factory. (Webc... https://t.co/PZ01dGut4a via @YouTube",FALSE,0,NA,2018-04-05 10:31:43,FALSE,NA,"981841807242768386",NA,"<a href=""http://twitter.com"" rel=""nofollow"">Twitter Web Client</a>","Yes2GlobalPeace",0,FALSE,FALSE,NA,NA
"1052","Elon Musk Reveals New Tesla Easter Eggs on Instagram - Interesting Engineering #tesla https://t.co/RlvPdGBPpS",FALSE,0,NA,2018-04-05 10:31:15,FALSE,NA,"981841689026482176",NA,"<a href=""http://dragplus.com"" rel=""nofollow"">DragPlus</a>","foursquare_dp",0,FALSE,FALSE,NA,NA
"1053","Elon Musk‚Äôs Boring Company to sell LEGO-like bricks that can be used to build housing https://t.co/IWsWcLHBz3",FALSE,0,NA,2018-04-05 10:31:04,FALSE,NA,"981841642943602688",NA,"<a href=""http://www.facebook.com/twitter"" rel=""nofollow"">Facebook</a>","ExpertTitle",0,FALSE,FALSE,NA,NA
"1054","Steve Jobs encouraged us to think different. Elon #Musk encourages us to think big. From @hacktheproduct via‚Ä¶ https://t.co/4wFh8zFNM2",FALSE,0,NA,2018-04-05 10:30:32,FALSE,NA,"981841512286883841",NA,"<a href=""http://bufferapp.com"" rel=""nofollow"">Buffer</a>","peter_ryans",0,FALSE,FALSE,NA,NA
"1055","Elon Musk Offering To Buy From Mark Zuckerberg And Then Delete Facebook Is Satirical News https://t.co/LbR6hKWf2w‚Ä¶ https://t.co/8MFbUsltG4",FALSE,0,NA,2018-04-05 10:30:22,TRUE,NA,"981841466745151488",NA,"<a href=""https://www.socialjukebox.com"" rel=""nofollow"">The Social Jukebox</a>","InfoProNetwork",0,FALSE,FALSE,NA,NA
"1056","‚ÄúPeople should pursue what they're passionate about. That will make them happier than pretty much anything else.‚Äù - Elon Musk",FALSE,159,NA,2018-04-05 10:30:01,FALSE,NA,"981841381336469504",NA,"<a href=""http://socialbee.io/"" rel=""nofollow"">SocialBee.io</a>","ElonMuskNewsOrg",55,FALSE,FALSE,NA,NA
"1057","From #Slovakia to Elon Musk - that's the journey of Slovak @Slidoapp! Let's get inspired by the Czech and Slovak co‚Ä¶ https://t.co/T9c3LXGetc",FALSE,2,NA,2018-04-05 10:30:01,TRUE,NA,"981841379520335873",NA,"<a href=""http://twitter.com/download/android"" rel=""nofollow"">Twitter for Android</a>","PragueConBureau",0,FALSE,FALSE,NA,NA
"1058","#HealTheWorldIn5Words
We still have Elon Musk",FALSE,1,NA,2018-04-05 10:29:28,FALSE,NA,"981841242094034944",NA,"<a href=""http://twitter.com/download/android"" rel=""nofollow"">Twitter for Android</a>","CDakkar",0,FALSE,FALSE,NA,NA
"1059","Elon Musk Jokes About Tesla‚Äôs Debt ‚Äì But the Joke Could Be on the U.S. - https://t.co/AySYQYetUQ https://t.co/Sh6kzXvBgy",FALSE,0,NA,2018-04-05 10:28:09,FALSE,NA,"981840910144229377",NA,"<a href=""http://investmentwatchblog.com"" rel=""nofollow"">InvestmentWatch</a>","InvestWatchBlog",0,FALSE,FALSE,NA,NA
"1060","Last night kind of a blur but there was some sort of rant about Elon musk tearing a hole in the ionosphere wasn't there?",FALSE,0,NA,2018-04-05 10:25:15,FALSE,NA,"981840182952443904",NA,"<a href=""http://twitter.com/download/android"" rel=""nofollow"">Twitter for Android</a>","princessesierra",0,FALSE,FALSE,NA,NA
"1061","@KamalaHarris First got to weed out charlatans like Elon Musk I guess",FALSE,0,"KamalaHarris",2018-04-05 10:24:52,FALSE,"975934204901982208","981840082591240192","30354991","<a href=""http://twitter.com"" rel=""nofollow"">Twitter Web Client</a>","robinivski",0,FALSE,FALSE,NA,NA
"1062","Top 5 Tech-billionaires Lifestyle : Elon Musk, Sundar Pichai , Mark Zuck... https://t.co/F6aiNQbawz via @YouTube",FALSE,0,NA,2018-04-05 10:24:13,FALSE,NA,"981839920812589056",NA,"<a href=""http://twitter.com"" rel=""nofollow"">Twitter Web Client</a>","Ratnaketu008",0,FALSE,FALSE,NA,NA
"1063","Elon Musk has no time for your false shit. https://t.co/XFawz1BLsz",FALSE,0,NA,2018-04-05 10:23:09,FALSE,NA,"981839651274133505",NA,"<a href=""https://ifttt.com"" rel=""nofollow"">IFTTT</a>","ComedyIsAJoke",0,FALSE,FALSE,NA,NA
"1064","Elon Musk has no time for your false shit. https://t.co/Gnx0iQ92B2 https://t.co/tWRnTQFizO",FALSE,0,NA,2018-04-05 10:20:15,FALSE,NA,"981838923608543234",NA,"<a href=""https://ifttt.com"" rel=""nofollow"">IFTTT</a>","YesFunnies",0,FALSE,FALSE,NA,NA
"1065","@TIME Elon Musk!!! Without doubt!
Also, please don't put Trump in the same list as these others.",FALSE,0,"TIME",2018-04-05 10:19:33,FALSE,"981811201544998914","981838745228988416","14293310","<a href=""http://twitter.com/download/android"" rel=""nofollow"">Twitter for Android</a>","Mymel95884329",0,FALSE,FALSE,NA,NA
"1066","@Funkyfetlock @paulygoo @sunriseon7 @RealMarkLatham Good on you if you could afford that! Chris I'm not trying to s‚Ä¶ https://t.co/lY61Az5Q1o",FALSE,0,"Funkyfetlock",2018-04-05 10:19:14,TRUE,"981826202011750400","981838666325635072","149339297","<a href=""http://twitter.com/#!/download/ipad"" rel=""nofollow"">Twitter for iPad</a>","stevie_bro",0,FALSE,FALSE,NA,NA
"1067","@PlowPlot @JennyVSimile @InternetEh good one. How about we kill the people that make the tools for the rich to exis‚Ä¶ https://t.co/LhgYz54F91",FALSE,0,"PlowPlot",2018-04-05 10:18:35,TRUE,"981826851004993536","981838501804167168","505122066","<a href=""http://twitter.com/download/android"" rel=""nofollow"">Twitter for Android</a>","voyagedelanuit",0,FALSE,FALSE,NA,NA
"1068","@elonmusk HaY! Musk I have a crazy idea. How can i reach you?
my adress: ismbayrak@yandex.com",FALSE,0,"elonmusk",2018-04-05 10:18:33,FALSE,"981583374933401602","981838493625278464","44196397","<a href=""http://twitter.com"" rel=""nofollow"">Twitter Web Client</a>","MadEvenMan",0,FALSE,FALSE,NA,NA
"1069","@Suii_Generiis Loooooool I think they might be involved in some way but not to the extent people make it out to be.‚Ä¶ https://t.co/Eh2CGZYOqU",FALSE,1,"Suii_Generiis",2018-04-05 10:18:26,TRUE,"981835963801440257","981838466911784960","150639152","<a href=""http://twitter.com/download/iphone"" rel=""nofollow"">Twitter for iPhone</a>","Serriusbleck",0,FALSE,FALSE,NA,NA
"1070","Elon Musk has no time for your false shit. https://t.co/tELRahhBUd",FALSE,0,NA,2018-04-05 10:18:20,FALSE,NA,"981838441565638656",NA,"<a href=""https://ifttt.com"" rel=""nofollow"">IFTTT</a>","technowarlock1",0,FALSE,FALSE,NA,NA
"1071","@elonmusk HaY! Musk I have a crazy idea.  How can i reach you?
my adress: ismbayrak@yandex.com",FALSE,0,"elonmusk",2018-04-05 10:17:43,FALSE,NA,"981838283410956288","44196397","<a href=""http://twitter.com"" rel=""nofollow"">Twitter Web Client</a>","MadEvenMan",0,FALSE,FALSE,NA,NA
"1072","This hyperloop startup is getting ready to take on Elon Musk https://t.co/Jtt5K5UMsT https://t.co/agLT6K7uCJ",FALSE,0,NA,2018-04-05 10:17:28,FALSE,NA,"981838220261511169",NA,"<a href=""https://ifttt.com"" rel=""nofollow"">IFTTT</a>","swissifg",0,FALSE,FALSE,NA,NA
"1073","New startup ‚Äú2060 Space Bar‚Äù aims to produce food for space travelers like Elon¬†Musk https://t.co/3elGLrnBXD https://t.co/uH7w2nt1bF",FALSE,5,NA,2018-04-05 10:17:18,FALSE,NA,"981838179765555200",NA,"<a href=""http://publicize.wp.com/"" rel=""nofollow"">WordPress.com</a>","AlgaeWorldNews",3,FALSE,FALSE,NA,NA
"1074","@chrissyteigen He‚Äôs so fucking jealous of innovators. He will go after Elon Musk next.",FALSE,0,"chrissyteigen",2018-04-05 10:16:49,FALSE,"981440916652257282","981838058893930496","39364684","<a href=""http://twitter.com/download/iphone"" rel=""nofollow"">Twitter for iPhone</a>","donnydarko966",0,FALSE,FALSE,NA,NA
"1075","Start-up legend Elon Musk offers a peek at his vision for strategic Dance Dance Revolution",FALSE,0,NA,2018-04-05 10:15:58,FALSE,NA,"981837846540627968",NA,"<a href=""http://cheapbotsdonequick.com"" rel=""nofollow"">Cheap Bots, Done Quick!</a>","ElonAnnounces",0,FALSE,FALSE,NA,NA
"1076","@stevemushero @mirceaulinic I'd wager that right about now Elon Musk is desperate for a bunch of ""older white guys""‚Ä¶ https://t.co/dfrxeFAurS",FALSE,1,"stevemushero",2018-04-05 10:14:34,TRUE,"981829090817617920","981837493149556736","47557864","<a href=""http://twitter.com"" rel=""nofollow"">Twitter Web Client</a>","__dotblake",0,FALSE,FALSE,NA,NA
"1077","This hyperloop startup is getting ready to take on Elon Musk https://t.co/3erbnUxsO0 https://t.co/MCgW3c71uC",FALSE,1,NA,2018-04-05 10:14:13,FALSE,NA,"981837402519080960",NA,"<a href=""https://ifttt.com"" rel=""nofollow"">IFTTT</a>","jaimeotero_",0,FALSE,FALSE,NA,NA
"1078","Elon Musk's Boring Company Will Soon Sell Lego-style Building Bricks https://t.co/Ugr8gLx0Vr",FALSE,0,NA,2018-04-05 10:13:12,FALSE,NA,"981837148058996736",NA,"<a href=""http://www.crowdfireapp.com"" rel=""nofollow"">Crowdfire - Go Big</a>","HibridoDesign",1,FALSE,FALSE,NA,NA
"1079","Elon Musk has no time for your false shit. https://t.co/w1rHaoDZpi",FALSE,1,NA,2018-04-05 10:11:37,FALSE,NA,"981836751349133313",NA,"<a href=""https://ifttt.com"" rel=""nofollow"">IFTTT</a>","Funny__247",0,FALSE,FALSE,NA,NA
"1080","@jennystrasburg @georgikantchev @DaveCBenoit Like Musk another clown....@elonmusk",FALSE,0,"jennystrasburg",2018-04-05 10:10:35,FALSE,"981827938189565953","981836490811629569","244169661","<a href=""http://twitter.com/download/android"" rel=""nofollow"">Twitter for Android</a>","Semakassa",0,FALSE,FALSE,NA,NA
"1081","Elon Musk has no time for your false shit. via /r/funny https://t.co/VnuHXTZmhL",FALSE,0,NA,2018-04-05 10:09:16,FALSE,NA,"981836156986888192",NA,"<a href=""https://ifttt.com"" rel=""nofollow"">IFTTT</a>","sgreenjuice",0,FALSE,FALSE,NA,NA
"1082","Elon Musk has no time for your false shit. via /https://t.co/i8FJGso6p2 https://t.co/0qgAUB3h42",FALSE,0,NA,2018-04-05 10:09:09,FALSE,NA,"981836130470547456",NA,"<a href=""https://ifttt.com"" rel=""nofollow"">IFTTT</a>","redditfunnies",0,FALSE,FALSE,NA,NA
"1083","@Serriusbleck LOL elon musk = lex luther... https://t.co/tsQLjTNIYC",FALSE,1,"Suii_Generiis",2018-04-05 10:08:30,FALSE,"981832659537186817","981835963801440257","150639152","<a href=""http://twitter.com/download/iphone"" rel=""nofollow"">Twitter for iPhone</a>","Suii_Generiis",1,FALSE,FALSE,NA,NA
"1084","I liked a @YouTube video https://t.co/nbmfYiyic0 Elon Musk Talks Physics On Model Y, Semi And Autonomous Driving (Webcast Recap)",FALSE,0,NA,2018-04-05 10:08:23,FALSE,NA,"981835937259941889",NA,"<a href=""http://www.google.com/"" rel=""nofollow"">Google</a>","dorsai_55",0,FALSE,FALSE,NA,NA
"1085","Elon Musk is posting about Easter Eggs reminds me of a fictional billionaire talking about easter eggs. What is this world even.",FALSE,0,NA,2018-04-05 10:07:23,FALSE,NA,"981835683575844864",NA,"<a href=""http://twitter.com/download/iphone"" rel=""nofollow"">Twitter for iPhone</a>","sapunintended",0,FALSE,FALSE,NA,NA
"1086","People work better when they know what the goal is and why. It is important that people look forward to coming to w‚Ä¶ https://t.co/9AfOzpVOuv",FALSE,4,NA,2018-04-05 10:06:19,TRUE,NA,"981835416923004928",NA,"<a href=""http://twitter.com"" rel=""nofollow"">Twitter Web Client</a>","ocka320",0,FALSE,FALSE,NA,NA
"1087","This hyperloop startup is getting ready to take on Elon Musk https://t.co/W87DymEovG https://t.co/qLRL3LeMzD",FALSE,0,NA,2018-04-05 10:06:13,FALSE,NA,"981835391287390208",NA,"<a href=""https://ifttt.com"" rel=""nofollow"">IFTTT</a>","Bullish",0,FALSE,FALSE,NA,NA
"1088","This hyperloop startup is getting ready to take on Elon Musk https://t.co/c4YXBiH5vB https://t.co/KGp51QrzYf",FALSE,0,NA,2018-04-05 10:06:11,FALSE,NA,"981835382412201984",NA,"<a href=""https://ifttt.com"" rel=""nofollow"">IFTTT</a>","shailendra_nair",0,FALSE,FALSE,NA,NA
"1089","This hyperloop startup is getting ready to take on Elon Musk https://t.co/2rqWiHEbuG https://t.co/RcJ0GKMhnW",FALSE,0,NA,2018-04-05 10:05:49,FALSE,NA,"981835291395846144",NA,"<a href=""https://ifttt.com"" rel=""nofollow"">IFTTT</a>","avasqueza",0,FALSE,FALSE,NA,NA
"1090","#group4mars @elonmusk @SpaceX, we are proud to present our water purification methods that can potentially be used‚Ä¶ https://t.co/9pwKHAhG3j",FALSE,0,NA,2018-04-05 10:05:45,TRUE,NA,"981835274266251270",NA,"<a href=""http://twitter.com"" rel=""nofollow"">Twitter Web Client</a>","Musk_We_Trust",0,FALSE,FALSE,NA,NA
"1091","@elonmusk dear mr musk! Would your new #tesla car tow my caravan?",FALSE,0,"elonmusk",2018-04-05 10:03:16,FALSE,NA,"981834646773288960","44196397","<a href=""http://twitter.com/download/iphone"" rel=""nofollow"">Twitter for iPhone</a>","timsharville",0,FALSE,FALSE,NA,NA
"1092","This hyperloop startup is getting ready to take on Elon Musk https://t.co/AgY1CwHA3D https://t.co/wRc9vlAtrr",FALSE,41,NA,2018-04-05 10:03:00,FALSE,NA,"981834581790941185",NA,"<a href=""http://www.socialflow.com"" rel=""nofollow"">SocialFlow</a>","business",24,FALSE,FALSE,NA,NA
"1093","Watch Elon Musk and Jonathan Nolan (the creator of Westworld) trailer for the Falcon Heavy launch https://t.co/PNQBUHMAjH",FALSE,0,NA,2018-04-05 10:01:37,FALSE,NA,"981834234359959552",NA,"<a href=""http://www.ajaymatharu.com/"" rel=""nofollow"">Tweet Old Post</a>","TechYouOutUK",0,FALSE,FALSE,NA,NA
"1094","SXSW: Elon Musk Didn‚Äôt Get Much Sleep This Weekend Either #participo https://t.co/i65eOlnFfx - get content from: https://t.co/YhucaqwO8w",FALSE,0,NA,2018-04-05 10:00:22,FALSE,NA,"981833918411431936",NA,"<a href=""https://commun.it"" rel=""nofollow"">Commun.it Intelligence</a>","UnknawM",0,FALSE,FALSE,NA,NA
"1095","Jay Z and Kanye West announce Watch The Throne reunion with Elon Musk for concert in space https://t.co/ig84SUv2RY",FALSE,0,NA,2018-04-05 09:58:12,FALSE,NA,"981833372493377537",NA,"<a href=""https://upflow.co"" rel=""nofollow"">Upflow</a>","bowenlibl",0,FALSE,FALSE,NA,NA
"1096","Recently I see a lot of people talking about ""the end"" of #Tesla and how the company is on a highway to yet another‚Ä¶ https://t.co/l9yseqIY7F",FALSE,0,NA,2018-04-05 09:57:16,TRUE,NA,"981833137406861312",NA,"<a href=""http://twitter.com"" rel=""nofollow"">Twitter Web Client</a>","davidpolanski8",0,FALSE,FALSE,NA,NA
"1097","@DavidAmoyal Kendrick Lamar , Stephen King , elon musk",FALSE,0,"DavidAmoyal",2018-04-05 09:54:17,FALSE,"981702270181093377","981832386089508864","356162725","<a href=""http://twitter.com/download/iphone"" rel=""nofollow"">Twitter for iPhone</a>","OrbOrbea",0,FALSE,FALSE,NA,NA
"1098","Elon Musk on Nikola Tesla ‚Äì What He Said May Shock You https://t.co/NzK8PbF7us via @YouTube",FALSE,0,NA,2018-04-05 09:50:11,FALSE,NA,"981831354651463680",NA,"<a href=""http://twitter.com"" rel=""nofollow"">Twitter Web Client</a>","RexhepiFlorin",0,FALSE,FALSE,NA,NA
"1099","I liked a @YouTube video https://t.co/E5o9r2Efg8 The Elon Musk Story | 3D Animated",FALSE,0,NA,2018-04-05 09:48:55,FALSE,NA,"981831038275084289",NA,"<a href=""http://www.google.com/"" rel=""nofollow"">Google</a>","wildwasser",0,FALSE,FALSE,NA,NA
"1100","@westcoastbill Hello! My name is Artemiy Shepelev, I'm the organizer of various Business Forums. We have a proposal‚Ä¶ https://t.co/plI8mxf8Gp",FALSE,0,"westcoastbill",2018-04-05 09:48:53,TRUE,NA,"981831028519161856","692023","<a href=""http://twitter.com"" rel=""nofollow"">Twitter Web Client</a>","av_shepelev",0,FALSE,FALSE,NA,NA
"1101","Elon Musk to announce new technology that could change¬†travel https://t.co/WKG1HP3i55 https://t.co/CjuUtUI6Y1",FALSE,0,NA,2018-04-05 09:48:30,FALSE,NA,"981830931454611456",NA,"<a href=""http://publicize.wp.com/"" rel=""nofollow"">WordPress.com</a>","AVNNewsFeed",0,FALSE,FALSE,NA,NA
"1102","Saudi Arabia's powerful crown prince is taking a landmark US tour, meeting with with stars from Elon Musk and Bill‚Ä¶ https://t.co/4UJOYLxRph",FALSE,0,NA,2018-04-05 09:36:46,TRUE,NA,"981827981634138112",NA,"<a href=""http://twitter.com"" rel=""nofollow"">Twitter Web Client</a>","abuqayyas",0,FALSE,FALSE,NA,NA
"1103","The shorts continue to circle ... 

Tesla‚Äôs Manufacturing ‚ÄòHell‚Äô Won‚Äôt Slow Down Electric Cars   via @NYTimes https://t.co/vXLasijwUg",FALSE,0,NA,2018-04-05 09:34:58,FALSE,NA,"981827528590614528",NA,"<a href=""http://twitter.com/#!/download/ipad"" rel=""nofollow"">Twitter for iPad</a>","NateNs5",0,FALSE,FALSE,NA,NA
"1104","@WSJ ELON MUSK!  HE CAN DO THIS.    All caps mean PASSION",FALSE,1,"WSJ",2018-04-05 09:31:00,FALSE,"907639982633910272","981826530266533888","3108351","<a href=""http://twitter.com/download/iphone"" rel=""nofollow"">Twitter for iPhone</a>","Violet6915",0,FALSE,FALSE,NA,NA
"1105","Elon Musk Reveals New Tesla Easter Eggs on Instagram https://t.co/4Koy70oDvu",FALSE,0,NA,2018-04-05 09:30:55,FALSE,NA,"981826508997255171",NA,"<a href=""http://twitter.com"" rel=""nofollow"">Twitter Web Client</a>","Shootertvt",0,FALSE,FALSE,NA,NA
"1106","Story of Elon Musk. #ElonMusk #Tesla #IOTA #future https://t.co/dzuQTU5p3a",FALSE,1,NA,2018-04-05 09:29:45,FALSE,NA,"981826212950618114",NA,"<a href=""http://twitter.com/download/android"" rel=""nofollow"">Twitter for Android</a>","Dan_iota",0,FALSE,FALSE,NA,NA
