"","text","favorited","favoriteCount","replyToSN","created","truncated","replyToSID","id","replyToUID","statusSource","screenName","retweetCount","isRetweet","retweeted","longitude","latitude"
"1","Shepard Fairey and Elon Musk are the same person.",FALSE,6,NA,2018-04-05 23:58:32,FALSE,NA,"982044851683250177",NA,"<a href=""http://twitter.com"" rel=""nofollow"">Twitter Web Client</a>","_JustinSloane",0,FALSE,FALSE,NA,NA
"2","maybe the robot makers shall program the robots to disobey when the order has bad conscience  https://t.co/B6Gk99Mpzp",FALSE,0,NA,2018-04-05 23:58:08,FALSE,NA,"982044748767690753",NA,"<a href=""http://twitter.com/download/android"" rel=""nofollow"">Twitter for Android</a>","bayadere2016",0,FALSE,FALSE,NA,NA
"3","New from my Wordpress: https://t.co/WKzq3V1oPl",FALSE,0,NA,2018-04-05 23:57:54,FALSE,NA,"982044690001399808",NA,"<a href=""http://www.facebook.com/twitter"" rel=""nofollow"">Facebook</a>","Anjokal",0,FALSE,FALSE,NA,NA
"4","This police department is switching to Tesla SUVs ‚Äî and Elon Musk is pleased
https://t.co/dssS3CFjga
Shared from my‚Ä¶ https://t.co/hYNt25MdqP",FALSE,0,NA,2018-04-05 23:56:51,TRUE,NA,"982044427077079041",NA,"<a href=""http://twitter.com"" rel=""nofollow"">Twitter Web Client</a>","bpmertz",0,FALSE,FALSE,NA,NA
"5","Elon Musk has pulled out all the stops with his latest project https://t.co/0eRHZ80m0X (https://t.co/Q6gzWzUR6d)",FALSE,0,NA,2018-04-05 23:56:01,FALSE,NA,"982044215147466752",NA,"<a href=""https://twitter.com/ImgurViral"" rel=""nofollow"">ImgurViral</a>","ImgurViral",0,FALSE,FALSE,NA,NA
"6","@elonmusk Breaking. No word yet on whether Elon Musk is a wittle baby. Stock holders are very shaken, but some say‚Ä¶ https://t.co/fABNdEsFpg",FALSE,0,"Bethan7rose",2018-04-05 23:55:33,TRUE,"982024259676659712","982044100609310720","2323902878","<a href=""http://twitter.com/download/android"" rel=""nofollow"">Twitter for Android</a>","Bethan7rose",0,FALSE,FALSE,NA,NA
"7","I rather intern for: Mark Cuban, Zuckerberg, Elon Musk or Jeff Bezos anyway.",FALSE,0,NA,2018-04-05 23:55:18,FALSE,NA,"982044038294593537",NA,"<a href=""https://mobile.twitter.com"" rel=""nofollow"">Twitter Lite</a>","Doxsburneracct",0,FALSE,FALSE,NA,NA
"8","@reaIDonadTrunp @elonmusk @NoceraBV @WSJ @Tesla hey fake donald trump, i have no idea what you are going through ev‚Ä¶ https://t.co/t0wuLQZGQq",FALSE,0,"reaIDonadTrunp",2018-04-05 23:51:24,TRUE,"980888524500090880","982043056458354690","793085599947206657","<a href=""http://twitter.com"" rel=""nofollow"">Twitter Web Client</a>","TheStampojken",0,FALSE,FALSE,NA,NA
"9","An Amerind ret billionaire has any hopeful ontogenesis layout. Lag Elon Musk is workings on a encephalon-pc port an‚Ä¶ https://t.co/nvmHvgN1kf",FALSE,0,NA,2018-04-05 23:50:32,TRUE,NA,"982042837821911045",NA,"<a href=""http://ismylife.h18.top/"" rel=""nofollow"">One such22222</a>","KeycravEmcryp",0,FALSE,FALSE,NA,NA
"10","What Elon Musk says to purpose fatigue #makerbrands https://t.co/hHbFjdpPHk",FALSE,0,NA,2018-04-05 23:49:22,FALSE,NA,"982042545420042241",NA,"<a href=""http://twitter.com/download/iphone"" rel=""nofollow"">Twitter for iPhone</a>","subodesh",0,FALSE,FALSE,NA,NA
"11","BREAKING: Elon Musk makes a guest appearance in the General Assembly! Gives his take on the AI question! #brismun18",FALSE,2,NA,2018-04-05 23:49:22,FALSE,NA,"982042542664441857",NA,"<a href=""http://twitter.com/download/android"" rel=""nofollow"">Twitter for Android</a>","Press_BrisMUN18",0,FALSE,FALSE,NA,NA
"12","my sister and I are talking about Tesla for some reason and I just remembered that up until about 2 or 3 years ago‚Ä¶ https://t.co/1OgOdfqXcX",FALSE,4,NA,2018-04-05 23:47:29,TRUE,NA,"982042071530917889",NA,"<a href=""http://twitter.com/download/iphone"" rel=""nofollow"">Twitter for iPhone</a>","TheUnseenNinja",0,FALSE,FALSE,NA,NA
"13","Elon, you should make cologne! Call it Musk, tag line: what the future smells like @elonmusk https://t.co/S0BNPB6Bl7",FALSE,1,NA,2018-04-05 23:47:12,FALSE,NA,"982041996469481472",NA,"<a href=""http://twitter.com/download/android"" rel=""nofollow"">Twitter for Android</a>","KellyRiffel",0,FALSE,FALSE,NA,NA
"14","@DailyCaller elon musk ins't even on the council anymore. and he doesn't like trump. and he have never said these m‚Ä¶ https://t.co/97oA90A7VP",FALSE,0,"DailyCaller",2018-04-05 23:46:38,TRUE,"981846065673588737","982041856073756673","39308549","<a href=""http://twitter.com"" rel=""nofollow"">Twitter Web Client</a>","TheStampojken",0,FALSE,FALSE,NA,NA
"15","Sorry @elonmusk but @Thom_astro, alias Thomas Pesquet, our best french astronaut, does not agree with you about the‚Ä¶ https://t.co/SKmt7dHhkp",FALSE,0,NA,2018-04-05 23:45:31,TRUE,NA,"982041575214764032",NA,"<a href=""http://twitter.com/download/iphone"" rel=""nofollow"">Twitter for iPhone</a>","BirdyMoNg",0,FALSE,FALSE,NA,NA
"16","I've literally been awake for like 2 hours watching Elon musk interview. I've wrote almost 3 pages of notes on thin‚Ä¶ https://t.co/IpiZ036cFd",FALSE,3,NA,2018-04-05 23:45:00,TRUE,NA,"982041443794608129",NA,"<a href=""http://twitter.com/download/android"" rel=""nofollow"">Twitter for Android</a>","fallawaycamila",0,FALSE,FALSE,NA,NA
"17","I liked a @YouTube video https://t.co/3lqz2Fim2L The Elon Musk Story | 3D Animated",FALSE,0,NA,2018-04-05 23:44:50,FALSE,NA,"982041403764232192",NA,"<a href=""http://www.google.com/"" rel=""nofollow"">Google</a>","zKejn",0,FALSE,FALSE,NA,NA
"18","@FaZeAdapt elon musk didnt fail precalc",FALSE,0,"FaZeAdapt",2018-04-05 23:44:34,FALSE,"982026692293099522","982041336646897665","532450135","<a href=""http://twitter.com"" rel=""nofollow"">Twitter Web Client</a>","NoahABurke",0,FALSE,FALSE,NA,NA
"19","@tictoc Please make Elon Musk stop.",FALSE,0,"tictoc",2018-04-05 23:42:05,FALSE,"982040490181787649","982040712308056064","252751061","<a href=""http://twitter.com/download/iphone"" rel=""nofollow"">Twitter for iPhone</a>","mikefabus",0,FALSE,FALSE,NA,NA
"20","I understand why you named your company the name that will change everything!!!  Elon musk your my modern day hero!!",FALSE,1,NA,2018-04-05 23:41:14,FALSE,NA,"982040494766084096",NA,"<a href=""http://twitter.com/download/android"" rel=""nofollow"">Twitter for Android</a>","Neil49900309",0,FALSE,FALSE,NA,NA
"21","Elon Musk wants to build a new-subway like system that prioritizes pedestrians and cyclists over cars #tictocnews https://t.co/wyYuknZFYV",FALSE,60,NA,2018-04-05 23:41:12,FALSE,NA,"982040490181787649",NA,"<a href=""http://www.socialflow.com"" rel=""nofollow"">SocialFlow</a>","tictoc",27,FALSE,FALSE,NA,NA
"22","I'm pretty sure Elon is some sort of beautiful minded alien sent to us to save the planet from our current nonsense‚Ä¶ https://t.co/s8fx2qAcIV",FALSE,1,NA,2018-04-05 23:39:58,TRUE,NA,"982040179492966405",NA,"<a href=""http://twitter.com/download/iphone"" rel=""nofollow"">Twitter for iPhone</a>","Shayfari",0,FALSE,FALSE,NA,NA
"23","Here‚Äôs what the first Tesla solar roofs look like in the wild https://t.co/qhy87eSYDU via @Curbed",FALSE,4,NA,2018-04-05 23:38:08,FALSE,NA,"982039715728666625",NA,"<a href=""http://twitter.com"" rel=""nofollow"">Twitter Web Client</a>","SoulfulRealtor",7,FALSE,FALSE,NA,NA
"24","""(...) I think I have much better solution, and I mean better for the species, if not our entire planet.‚Äù
 https://t.co/n1o2ilMlh5",FALSE,0,NA,2018-04-05 23:37:54,FALSE,NA,"982039659776823296",NA,"<a href=""http://twitter.com/download/android"" rel=""nofollow"">Twitter for Android</a>","josacme",0,FALSE,FALSE,NA,NA
"25","The Elon Musk Story | 3D Animated https://t.co/dfdyO1GQdC via @YouTube @elonmusk",FALSE,0,NA,2018-04-05 23:37:44,FALSE,NA,"982039614142763008",NA,"<a href=""http://twitter.com/download/iphone"" rel=""nofollow"">Twitter for iPhone</a>","ryavco",0,FALSE,FALSE,NA,NA
"26","@elonmusk Instagram is owned by Facebook
Whatchu going to do musk ????",FALSE,1,"elonmusk",2018-04-05 23:36:11,FALSE,"982009772793774080","982039224005419008","44196397","<a href=""http://twitter.com/download/android"" rel=""nofollow"">Twitter for Android</a>","takuuu_m",0,FALSE,FALSE,NA,NA
"27","$TSLA ""Government Tesla"" clubbed like a baby seal after hours. Down 8 points. People should do their research on th‚Ä¶ https://t.co/m51LPB8ezE",FALSE,12,NA,2018-04-05 23:35:36,TRUE,NA,"982039077687037953",NA,"<a href=""http://twitter.com"" rel=""nofollow"">Twitter Web Client</a>","BP_Rising",5,FALSE,FALSE,NA,NA
"28","I no longer like elon musk. This is by far the worst decision he has ever done. and I hope the next rocket he launc‚Ä¶ https://t.co/eWMRfPNpMD",FALSE,2,NA,2018-04-05 23:35:11,TRUE,NA,"982038974540730368",NA,"<a href=""https://mobile.twitter.com"" rel=""nofollow"">Twitter Lite</a>","Twistmasday",1,FALSE,FALSE,NA,NA
"29","@chris_emerson We really sucked at it. Would never have got Elon Musk or Tim Cook. Ariana Huffington looks great as a bloke though.",FALSE,1,"chris_emerson",2018-04-05 23:33:14,FALSE,"982038129170370561","982038481416450049","20874917","<a href=""http://twitter.com/download/android"" rel=""nofollow"">Twitter for Android</a>","madebyjenni",0,FALSE,FALSE,NA,NA
"30","BREAKING: Elon Musk sleeping at the factory to oversee cars coming off the line... 

Gung Ho (10/10) Movie CLIP - H‚Ä¶ https://t.co/EF1w0yMJa8",FALSE,8,NA,2018-04-05 23:32:34,TRUE,NA,"982038316890673153",NA,"<a href=""http://twitter.com/download/iphone"" rel=""nofollow"">Twitter for iPhone</a>","77cyko",0,FALSE,FALSE,NA,NA
"31","Elon Musk Deletes #SpaceX and #Tesla #FacebookDataLeaks Pages https://t.co/vhJaLijxve via @FortuneMagazine",FALSE,0,NA,2018-04-05 23:31:59,FALSE,NA,"982038169657991168",NA,"<a href=""http://twitter.com/download/android"" rel=""nofollow"">Twitter for Android</a>","pamnsc",1,FALSE,FALSE,NA,NA
"32","@_sara_4A @ObiWanCorbyni @PrisonPlanet This was a quote from Elon Musk, after he deleted his company‚Äôs Facebook.",FALSE,2,"_sara_4A",2018-04-05 23:31:47,FALSE,"982037198362071042","982038120412545024","1013813940","<a href=""http://twitter.com/download/iphone"" rel=""nofollow"">Twitter for iPhone</a>","HYL_Mickey_M",0,FALSE,FALSE,NA,NA
"33","""Hard-won things are more valuable than those that come too easily."" - Elon Musk",FALSE,0,NA,2018-04-05 23:30:13,FALSE,NA,"982037724969529350",NA,"<a href=""http://www.hootsuite.com"" rel=""nofollow"">Hootsuite</a>","QCSSInc",0,FALSE,FALSE,NA,NA
"34","5 Things Successful #Entrepreneurs Like Elon Musk Know That You Don't https://t.co/c6mdndp9HH @INC https://t.co/Xpxd1a2MhJ",FALSE,0,NA,2018-04-05 23:25:05,FALSE,NA,"982036433950126080",NA,"<a href=""http://bufferapp.com"" rel=""nofollow"">Buffer</a>","EmaiLabBlog",0,FALSE,FALSE,NA,NA
"35","@KevinReinholz A comedian I like, Laurie Kilmartin, wrote a sarcastic tweet about Elon Musk‚Äôs rocket launch, and wa‚Ä¶ https://t.co/BRicls7nDp",FALSE,1,"KevinReinholz",2018-04-05 23:25:00,TRUE,"977600067627438080","982036409430298625","836386225040678912","<a href=""http://twitter.com/download/iphone"" rel=""nofollow"">Twitter for iPhone</a>","alaceywill",0,FALSE,FALSE,NA,NA
"36","Elon Musk Offers To Buy And Then Delete Facebook https://t.co/NDMyMnBm5G",FALSE,10,NA,2018-04-05 23:24:41,FALSE,NA,"982036330342334465",NA,"<a href=""http://twitter.com"" rel=""nofollow"">Twitter Web Client</a>","paradoxeparadis",1,FALSE,FALSE,NA,NA
"37","Former FBI &amp; CIA agent Phil Mudd wins an Oscar for his CNN performance, with comment from Elon Musk
#FakeNewsAwards‚Ä¶ https://t.co/4BlgnpiLKI",FALSE,0,NA,2018-04-05 23:21:17,TRUE,NA,"982035475450937344",NA,"<a href=""http://twitter.com/#!/download/ipad"" rel=""nofollow"">Twitter for iPad</a>","Turntablizm",0,FALSE,FALSE,NA,NA
"38","How Elon Musk‚Äôs New Rocket Helped This Online Store Take Off https://t.co/Uax4pGD6Nc https://t.co/L5i6wWc8jS",FALSE,0,NA,2018-04-05 23:21:03,FALSE,NA,"982035418404278273",NA,"<a href=""http://bufferapp.com"" rel=""nofollow"">Buffer</a>","GrowthHackersUK",0,FALSE,FALSE,NA,NA
"39","Elon Musk's Neuralink files permit to build biological research lab https://t.co/udwUR3isjp #science #technology #business",FALSE,2,NA,2018-04-05 23:20:54,FALSE,NA,"982035380684771329",NA,"<a href=""http://twitter.com"" rel=""nofollow"">Twitter Web Client</a>","JTMacKinnon",1,FALSE,FALSE,NA,NA
"40","Elon Musk hits back at safety board over fatal crash - https://t.co/YuXoGa2iUe : https://t.co/NtQkBKDfNL",FALSE,0,NA,2018-04-05 23:19:35,FALSE,NA,"982035046591676416",NA,"<a href=""http://www.flight.org"" rel=""nofollow"">NTSB News</a>","UnofficialNTSB",0,FALSE,FALSE,NA,NA
"41","@Taden90 I fuck with Hov but personally I‚Äôd rather chat up with Zuckerburg or Elon Musk, DJ or Cuban but niggas fro‚Ä¶ https://t.co/SHKCs5lr5l",FALSE,0,"Taden90",2018-04-05 23:19:18,TRUE,"982034013215952896","982034978883055616","435438786","<a href=""http://tapbots.com/tweetbot"" rel=""nofollow"">Tweetbot for iŒüS</a>","rangeroversheed",0,FALSE,FALSE,NA,NA
"42","This debate has never been more relevant, now that private investors like Elon Musk are getting into the space expl‚Ä¶ https://t.co/FkpDTJWT2o",FALSE,3,NA,2018-04-05 23:19:01,TRUE,NA,"982034907236093953",NA,"<a href=""https://www.sprinklr.com"" rel=""nofollow"">Sprinklr</a>","BigHistoryPro",0,FALSE,FALSE,NA,NA
"43","Tesla will allow owners to request the latest software update, Elon Musk says - Electrek https://t.co/NqrfYrw3lj https://t.co/eJKkN4UixH",FALSE,0,NA,2018-04-05 23:17:05,FALSE,NA,"982034417173446656",NA,"<a href=""https://dlvrit.com/"" rel=""nofollow"">dlvr.it</a>","metricimpact",0,FALSE,FALSE,NA,NA
"44","Tesla will allow owners to request the latest software update, Elon Musk says - Electrek https://t.co/UqduAgjgeO",FALSE,0,NA,2018-04-05 23:17:03,FALSE,NA,"982034412580687872",NA,"<a href=""https://dlvrit.com/"" rel=""nofollow"">dlvr.it</a>","FreewareUpdates",0,FALSE,FALSE,NA,NA
"45","Start-up dreamer Elon Musk to announce a leftfield masterstroke: solid-state cyberpunks",FALSE,0,NA,2018-04-05 23:15:58,FALSE,NA,"982034139628167168",NA,"<a href=""http://cheapbotsdonequick.com"" rel=""nofollow"">Cheap Bots, Done Quick!</a>","ElonAnnounces",0,FALSE,FALSE,NA,NA
"46","Planning to join Elon Musk on MARS?? BREAKING: Study says land degradation could affect 3.2bn people through mass m‚Ä¶ https://t.co/fd842g5qwQ",FALSE,1,NA,2018-04-05 23:15:11,TRUE,NA,"982033942826991617",NA,"<a href=""http://twitter.com"" rel=""nofollow"">Twitter Web Client</a>","cleanfoodearth",0,FALSE,FALSE,NA,NA
"47","AI 'more dangerous than nukes': Elon Musk still firm on regulatory oversight.
https://t.co/MOc5eDhhHq",FALSE,0,NA,2018-04-05 23:14:46,FALSE,NA,"982033836505686016",NA,"<a href=""http://twitter.com/download/android"" rel=""nofollow"">Twitter for Android</a>","wdStrickler",0,FALSE,FALSE,NA,NA
"48","@elonmusk Mate would you consider changing your middle name to ‚ÄòGated‚Äô? Elon Gated Musk.",FALSE,1,"elonmusk",2018-04-05 23:13:36,FALSE,"982009772793774080","982033541255970816","44196397","<a href=""https://mobile.twitter.com"" rel=""nofollow"">Twitter Lite</a>","ashwinsgopal",0,FALSE,FALSE,NA,NA
"49","Elon Musk: Tesla's Model 3 factory could look like an alien warship - The Washington Post https://t.co/ceyJr9awNF",FALSE,0,NA,2018-04-05 23:13:19,FALSE,NA,"982033471915741185",NA,"<a href=""https://mobile.twitter.com"" rel=""nofollow"">Mobile Web (M2)</a>","LifeEconomics",1,FALSE,FALSE,NA,NA
"50","#Science - Elon Musk's Neuralink may have tested interfaces on animals, The plans, conta... https://t.co/UhULBUOmzt https://t.co/16Fl97jFy4",FALSE,0,NA,2018-04-05 23:13:02,FALSE,NA,"982033399354245120",NA,"<a href=""http://www.comerciocenter.net"" rel=""nofollow"">ComercioCenter</a>","GNews_Center",0,FALSE,FALSE,NA,NA
"51","Musk: ""Car biz is hell."" The next circle of hell: Tesla is heading for a cash crunch https://t.co/nlw2kLFKDJ via @TheEconomist",FALSE,0,NA,2018-04-05 23:13:00,FALSE,NA,"982033392907816966",NA,"<a href=""http://twitter.com"" rel=""nofollow"">Twitter Web Client</a>","brianzen",0,FALSE,FALSE,NA,NA
"52","This police department is switching to Tesla SUVs ‚Äî and Elon Musk is pleased: submitted by‚Ä¶ https://t.co/y4Nf4tc54r",FALSE,0,NA,2018-04-05 23:11:50,FALSE,NA,"982033097070993413",NA,"<a href=""http://www.google.com/"" rel=""nofollow"">Google</a>","RdtTechnology",0,FALSE,FALSE,NA,NA
"53","That's no moon... the @FCC greenlit @SpaceX's plan to build a global broadband network using a constellation of 4,0‚Ä¶ https://t.co/bDs6sWATdE",FALSE,7,NA,2018-04-05 23:10:02,TRUE,NA,"982032644971094021",NA,"<a href=""http://www.hubspot.com/"" rel=""nofollow"">HubSpot</a>","CBinsights",9,FALSE,FALSE,NA,NA
"54","This police department is switching to Tesla SUVs ‚Äî and Elon Musk is pleased https://t.co/iVnv4XifIp",FALSE,0,NA,2018-04-05 23:05:38,FALSE,NA,"982031537024700418",NA,"<a href=""http://twitter.com"" rel=""nofollow"">Twitter Web Client</a>","charlierichmond",1,FALSE,FALSE,NA,NA
"55","Elon Musk would like to thank all the courageous #alpha testers putting life and limb on the line to test Tesla's p‚Ä¶ https://t.co/Baaf6PDxdd",FALSE,0,NA,2018-04-05 23:05:08,TRUE,NA,"982031411413770241",NA,"<a href=""http://www.facebook.com/twitter"" rel=""nofollow"">Facebook</a>","SavingsJones",0,FALSE,FALSE,NA,NA
"56","Google Brain founder Andrew Ng, Affectiva CEO Rana el Kaliouby, Osaka University professor Hiroshi Ishiguro,¬†entrep‚Ä¶ https://t.co/DlhBF4EUEN",FALSE,1,NA,2018-04-05 23:02:53,TRUE,NA,"982030847413923840",NA,"<a href=""http://twitter.com/download/android"" rel=""nofollow"">Twitter for Android</a>","kasoutuhka",0,FALSE,FALSE,NA,NA
"57","Prolly not a better role model for cramming stuff in your bean then Elon Musk...great share @Judy_Albers https://t.co/gJwVv4F5nI",FALSE,0,NA,2018-04-05 23:01:47,FALSE,NA,"982030570418065410",NA,"<a href=""http://twitter.com"" rel=""nofollow"">Twitter Web Client</a>","bloom_rob",0,FALSE,FALSE,NA,NA
"58","Elon Musk on Instagram: ‚ÄúMy secret to looking good is staying in shape and knowing my angles‚Äù https://t.co/i5rw3FogU5",FALSE,0,NA,2018-04-05 23:01:43,FALSE,NA,"982030551455498240",NA,"<a href=""http://www.bit.ly/itshotshit"" rel=""nofollow"">itshotshit</a>","itshotshit",0,FALSE,FALSE,NA,NA
"59","Elon Musk 'I Don't Give A Damn About Your Degree' https://t.co/JcUiGOXTkM via @YouTube",FALSE,0,NA,2018-04-05 23:01:38,FALSE,NA,"982030532337963009",NA,"<a href=""http://twitter.com/download/iphone"" rel=""nofollow"">Twitter for iPhone</a>","brianrfh",0,FALSE,FALSE,NA,NA
"60","This police department is switching to Tesla SUVs ‚Äî and Elon Musk is pleased https://t.co/xJ9VdS3LGF",FALSE,0,NA,2018-04-05 23:01:29,FALSE,NA,"982030492672364544",NA,"<a href=""https://ifttt.com"" rel=""nofollow"">IFTTT</a>","Reg_Digital",0,FALSE,FALSE,NA,NA
"61","A lot of great minds are and we're physicists. Albert Einstein, Stephen Hawkins, and  Elon Musk",FALSE,0,NA,2018-04-05 23:00:15,FALSE,NA,"982030180985327616",NA,"<a href=""http://twitter.com/download/iphone"" rel=""nofollow"">Twitter for iPhone</a>","Cudi_Montana",0,FALSE,FALSE,NA,NA
"62","@CJGraby @habitual_shaker @techreview i don't want to ask elon musk anything, thank you",FALSE,38,"CJGraby",2018-04-05 22:59:47,FALSE,"981901638330998785","982030064362688512","2573106920","<a href=""http://twitter.com"" rel=""nofollow"">Twitter Web Client</a>","oborolesbian",0,FALSE,FALSE,NA,NA
"63","@TechCrunch @Google What about StarLink (StarNet) by Elon Musk?",FALSE,0,"TechCrunch",2018-04-05 22:59:17,FALSE,"981717576672739329","982029938432802818","816653","<a href=""http://twitter.com"" rel=""nofollow"">Twitter Web Client</a>","gmxmatei",0,FALSE,FALSE,NA,NA
"64","Elon Musk will never stop failing. That's why he's so successful @mbcheng15 https://t.co/VFycI5h0yV via @Inc",FALSE,0,NA,2018-04-05 22:58:19,FALSE,NA,"982029696111185925",NA,"<a href=""http://twitter.com"" rel=""nofollow"">Twitter Web Client</a>","R0B0TgirL",0,FALSE,FALSE,NA,NA
"65","The Many Businesses of Elon Musk https://t.co/X86ohGuORl @EricProfits https://t.co/jMXV4Tde0G",FALSE,5,NA,2018-04-05 22:58:01,FALSE,NA,"982029619997085696",NA,"<a href=""http://bufferapp.com"" rel=""nofollow"">Buffer</a>","due",3,FALSE,FALSE,NA,NA
"66","&lt;b&gt;Elon Musk&lt;/b&gt; Teases Tesla-Branded Tequila I Fortune: Is Elon Musk's Tesla-branded‚Ä¶ https://t.co/LDDcRdOrVP",FALSE,0,NA,2018-04-05 22:56:25,FALSE,NA,"982029216966422528",NA,"<a href=""http://www.google.com/"" rel=""nofollow"">Google</a>","americearnmoney",0,FALSE,FALSE,NA,NA
"67","&lt;b&gt;Elon Musk&lt;/b&gt; Shares Tesla Model S Easter Eggs on Social Media: Elon Musk is pretty much‚Ä¶ https://t.co/bdizStubq2",FALSE,0,NA,2018-04-05 22:56:24,FALSE,NA,"982029215385161731",NA,"<a href=""http://www.google.com/"" rel=""nofollow"">Google</a>","americearnmoney",0,FALSE,FALSE,NA,NA
"68","Tesla's negative cashflow is positively correlated with revenue. The more they sell, the more they lose. Why? Becau‚Ä¶ https://t.co/K8guE9XSTO",FALSE,2,NA,2018-04-05 22:55:17,TRUE,NA,"982028931632123905",NA,"<a href=""http://twitter.com"" rel=""nofollow"">Twitter Web Client</a>","christophermah3",1,FALSE,FALSE,NA,NA
"69","if we‚Äôre a simulation why did the engineers/players add a dream feature ma byestafido menna elon musk pls fasser",FALSE,10,NA,2018-04-05 22:55:07,FALSE,NA,"982028892079902720",NA,"<a href=""http://twitter.com/download/iphone"" rel=""nofollow"">Twitter for iPhone</a>","reemxxo",2,FALSE,FALSE,NA,NA
"70","@nycjim @Twitlertwit Get MR. MUSK ELON and NASA to blast it off to MARS.",FALSE,2,"nycjim",2018-04-05 22:53:16,FALSE,"979683657614061570","982028424469450753","14940354","<a href=""http://twitter.com"" rel=""nofollow"">Twitter Web Client</a>","NecktopP",1,FALSE,FALSE,NA,NA
"71","Elon Musk Shares Tesla Model S Easter Eggs on Social Media https://t.co/3lNKR5K2lu https://t.co/5m52YS5ZJG",FALSE,0,NA,2018-04-05 22:53:13,FALSE,NA,"982028412419112961",NA,"<a href=""https://dlvrit.com/"" rel=""nofollow"">dlvr.it</a>","startupcrunch",0,FALSE,FALSE,NA,NA
"72","This police department is switching to Tesla SUVs ‚Äî and Elon Musk is pleased https://t.co/1N4O9MkmNH",FALSE,0,NA,2018-04-05 22:53:11,FALSE,NA,"982028404823240705",NA,"<a href=""https://dlvrit.com/"" rel=""nofollow"">dlvr.it</a>","startupcrunch",0,FALSE,FALSE,NA,NA
"73","How Elon Musk‚Äôs brother Kimbal Musk is reimagining farming https://t.co/TGvOQBphUc",FALSE,0,NA,2018-04-05 22:53:11,FALSE,NA,"982028403690754048",NA,"<a href=""https://dlvrit.com/"" rel=""nofollow"">dlvr.it</a>","startupcrunch",0,FALSE,FALSE,NA,NA
"74","With Model 3 production under the microscope, Elon Musk is back to sleeping at Tesla‚Äôs factory‚Ä¶ https://t.co/4cJLsrhqxo",FALSE,0,NA,2018-04-05 22:53:10,TRUE,NA,"982028401102876672",NA,"<a href=""https://dlvrit.com/"" rel=""nofollow"">dlvr.it</a>","startupcrunch",0,FALSE,FALSE,NA,NA
"75","Elon Musk Teases a Tesla-Branded Tequila https://t.co/wGjmdoyWmg https://t.co/F9YxR73yRK",FALSE,0,NA,2018-04-05 22:53:09,FALSE,NA,"982028395352477696",NA,"<a href=""https://dlvrit.com/"" rel=""nofollow"">dlvr.it</a>","startupcrunch",0,FALSE,FALSE,NA,NA
"76","Elon Musk doubles down on his controversial April Fools' joke with an Instagram photo of a Tesla-branded tequila bo‚Ä¶ https://t.co/ZOs0mB8HMg",FALSE,0,NA,2018-04-05 22:53:07,TRUE,NA,"982028389815992321",NA,"<a href=""https://dlvrit.com/"" rel=""nofollow"">dlvr.it</a>","startupcrunch",0,FALSE,FALSE,NA,NA
"77","Elon Musk‚Äôs April Fools‚Äô tweets were ‚Äònot a joking matter,‚Äô experts say https://t.co/GG1OaubFoO https://t.co/i8Arzu7Myy",FALSE,0,NA,2018-04-05 22:53:06,FALSE,NA,"982028384854130688",NA,"<a href=""https://dlvrit.com/"" rel=""nofollow"">dlvr.it</a>","startupcrunch",0,FALSE,FALSE,NA,NA
"78","Tesla goes bankrupt in Elon Musk April Fools' Day gag https://t.co/nUjqQmlfxw https://t.co/mOQohFWY81",FALSE,0,NA,2018-04-05 22:53:05,FALSE,NA,"982028377887465472",NA,"<a href=""https://dlvrit.com/"" rel=""nofollow"">dlvr.it</a>","startupcrunch",0,FALSE,FALSE,NA,NA
"79","Tesla Has Tons of Problems and Elon Musk Says He‚Äôs Sleeping at the Factory to Fix Them https://t.co/IyQcq6s36l https://t.co/RvzjIFfRV5",FALSE,0,NA,2018-04-05 22:53:02,FALSE,NA,"982028368693542912",NA,"<a href=""https://dlvrit.com/"" rel=""nofollow"">dlvr.it</a>","startupcrunch",0,FALSE,FALSE,NA,NA
"80","Elon Musk takes charge of Tesla Model 3 production https://t.co/rohZYLpIMc https://t.co/p0KmkGQwTa",FALSE,0,NA,2018-04-05 22:52:44,FALSE,NA,"982028290193002497",NA,"<a href=""https://dlvrit.com/"" rel=""nofollow"">dlvr.it</a>","startupcrunch",0,FALSE,FALSE,NA,NA
"81","@elonmusk let me see your angles Elon Musk.",FALSE,1,"elonmusk",2018-04-05 22:51:55,FALSE,"982009772793774080","982028087331241984","44196397","<a href=""http://twitter.com"" rel=""nofollow"">Twitter Web Client</a>","1988JesusChrist",0,FALSE,FALSE,NA,NA
"82","Elon Musk Is an Asshole https://t.co/j7CRdxKQDr via @Splinter_news",FALSE,0,NA,2018-04-05 22:51:09,FALSE,NA,"982027894162640897",NA,"<a href=""http://twitter.com"" rel=""nofollow"">Twitter Web Client</a>","sweetbutterblis",0,FALSE,FALSE,NA,NA
"83","Tesla will allow owners to request the latest software update, Elon Musk says - https://t.co/Ew25Xx1BLv via https://t.co/PSJJSOLfmD",FALSE,0,NA,2018-04-05 22:50:42,FALSE,NA,"982027779934904320",NA,"<a href=""http://twitter.com"" rel=""nofollow"">Twitter Web Client</a>","Yes2GlobalPeace",0,FALSE,FALSE,NA,NA
"84","Sustainable development: Tesla now makes solar roofs. https://t.co/gEL3loCPLG",FALSE,0,NA,2018-04-05 22:50:07,FALSE,NA,"982027631326564352",NA,"<a href=""http://www.hootsuite.com"" rel=""nofollow"">Hootsuite</a>","StreetSideVan",0,FALSE,FALSE,NA,NA
"85","@elonmusk Elon Musk is short for Elongated Muskrat",FALSE,0,"elonmusk",2018-04-05 22:49:18,FALSE,"982017761575518208","982027427856596992","44196397","<a href=""http://twitter.com/download/android"" rel=""nofollow"">Twitter for Android</a>","Im_Schleep_cuz",0,FALSE,FALSE,NA,NA
